{
  "version": 1,
  "need": {
    "words": "liczby parzyste",
    "language": "pl",
    "grade": "3",
    "limit": 20
  },
  "arm": "B1",
  "stage": "final",
  "timing_ms": {
    "embed": 41.2,
    "vectors": 18.5,
    "rows": 6.1,
    "keyword": 9.4,
    "rerank": 212.0,
    "total": 290.3
  },
  "cache": "miss",
  "rows": [
    {
      "id": "set_khan_fx0009",
      "rank": 1,
      "score": 0.912,
      "arm": "B1",
      "vector_score": 0.781,
      "bm25_score": 7.42,
      "rerank_score": 0.912,
      "best_view": "meaning_pl",
      "view_scores": {
        "title": 0.702,
        "meaning_pl": 0.781,
        "meaning_en": 0.744
      },
      "grade": "3",
      "titles": {
        "pl": "Liczby parzyste",
        "en": "Even numbers"
      },
      "languages": ["pl"],
      "skill_ids": ["proposed:fixture.even"],
      "curriculum_tags": ["pl-2017:II.3.2", "ccss:2.NBT.B.5"],
      "problem_types": ["Liczby parzyste"],
      "question_types": ["multi_select"],
      "views": ["title", "samples", "meaning_pl", "meaning_en", "needs"],
      "source": "khan",
      "credit": "Fixture set, our own small bank, https://fixture.invalid/jw/set_khan_fx0009",
      "enrichment": {
        "summary": {
          "pl": "Zmyślony zestaw: mnożenie przez 6.",
          "en": "A made-up set: multiplying by 6."
        },
        "can_do": {
          "pl": "Umiem pomnożyć przez 6.",
          "en": "I can multiply by 6."
        },
        "mistake_classes": [
          {
            "id": "added_instead",
            "pl": "dodaje zamiast mnożyć",
            "en": "adds instead of multiplying",
            "spot": "6 · 3 answered 9"
          }
        ],
        "contexts": {
          "pl": [],
          "en": []
        }
      },
      "content_hash": "3f1c8a0e5b7d2f94c6a1e0b8d7f3a2c95e4b6d1a0f8c7e2b9d3a5f6c1e0b7d48",
      "media": [],
      "items": 11
    }
  ],
  "state": [
    {
      "arm": "A",
      "state": "not_asked"
    },
    {
      "arm": "A1",
      "state": "not_asked"
    },
    {
      "arm": "B",
      "state": "not_asked"
    },
    {
      "arm": "B1",
      "state": "ok"
    },
    {
      "arm": "C",
      "state": "not_asked"
    },
    {
      "arm": "C2",
      "state": "not_asked"
    }
  ]
}
