{
  "version": 1,
  "need": {
    "words": "dodawanie do 100",
    "language": "pl",
    "grade": "3",
    "limit": 20
  },
  "arm": "B1",
  "stage": "final",
  "timing_ms": {
    "embed": 41.2,
    "vectors": 18.5,
    "rows": 6.1,
    "keyword": 9.4,
    "rerank": 212.0,
    "total": 290.3
  },
  "cache": "miss",
  "rows": [
    {
      "id": "set_khan_xd4e5f6",
      "rank": 1,
      "score": 0.912,
      "arm": "B1",
      "vector_score": 0.781,
      "bm25_score": 7.42,
      "rerank_score": 0.912,
      "best_view": "meaning_pl",
      "view_scores": { "title": 0.702, "meaning_pl": 0.781, "meaning_en": 0.744 },
      "grade": "2",
      "titles": { "pl": "Dodawanie w zakresie 100", "en": "Add within 100" },
      "languages": ["pl", "en"],
      "skill_ids": ["maths.add.within100"],
      "curriculum_tags": ["pl-2017:II.3.2", "ccss:2.NBT.B.5"],
      "problem_types": ["add-two-digit"],
      "question_types": ["numeric-input"],
      "views": ["title", "samples", "meaning_pl", "meaning_en", "needs"],
      "source": "khan",
      "credit": "Khan Academy, CC BY-NC-SA 4.0, https://www.khanacademy.org/math/cc-2nd-grade-math/x3184e0ec:add-and-subtract-within-100/e/adding-within-100",
      "enrichment": {
        "summary": {
          "pl": "Dodawanie dwucyfrowe w zakresie 100, z przekroczeniem progu i bez.",
          "en": "Two-digit addition within 100, with and without regrouping."
        },
        "can_do": {
          "pl": "Umiem dodać dwie liczby do 100.",
          "en": "I can add two numbers within 100."
        },
        "mistake_classes": [
          {
            "id": "regrouping",
            "pl": "gubi przeniesienie dziesiątki",
            "en": "drops the carried ten",
            "spot": "47 + 25 answered 62"
          }
        ],
        "contexts": { "pl": ["zakupy"], "en": ["shopping"] }
      },
      "content_hash": "3f1c8a0e5b7d2f94c6a1e0b8d7f3a2c95e4b6d1a0f8c7e2b9d3a5f6c1e0b7d48",
      "media": [],
      "items": 12
    },
    {
      "id": "set_khan_xj1k2l3",
      "rank": 2,
      "score": 0.734,
      "arm": "B1",
      "vector_score": 0.702,
      "bm25_score": null,
      "rerank_score": 0.734,
      "best_view": "meaning_en",
      "view_scores": { "title": 0.655, "meaning_en": 0.702 },
      "grade": "3",
      "titles": { "en": "Add and subtract within 1000" },
      "languages": ["en"],
      "skill_ids": ["maths.add.within1000"],
      "curriculum_tags": ["ccss:3.NBT.A.2"],
      "problem_types": ["add-three-digit"],
      "question_types": ["numeric-input"],
      "views": ["title", "samples", "meaning_en", "needs"],
      "source": "khan",
      "credit": "Khan Academy, CC BY-NC-SA 4.0, https://www.khanacademy.org/math/cc-third-grade-math/addition-and-subtraction-3/e/add-within-1000",
      "content_hash": "a9e2d47b1c0f6e8d3b5a7c2e9f1d4b6a8c0e3f5d7b9a1c2e4f6d8b0a3c5e7f91",
      "media": [],
      "items": 10
    }
  ],
  "state": [
    { "arm": "A", "state": "not_asked" },
    { "arm": "A1", "state": "not_asked" },
    { "arm": "B", "state": "not_asked" },
    { "arm": "B1", "state": "ok" },
    { "arm": "C", "state": "not_asked" },
    { "arm": "C2", "state": "not_asked" }
  ]
}
